[
  {
    "bike_id": "601",
    "bike_model": "CLASSIC",
    "duration_ms": 900000,
    "end_station_code": "001030",
    "end_station_name": "Constructed End C",
    "end_ts_local": "2026-01-01T08:15:00+00:00",
    "header_variant_id": "sha256:bd7b2ebb5148dca5b4b4bce591d0a9acc062c9e3df6cc7eb92530a083c78e7e5",
    "ownership_end": "2026-01-02",
    "ownership_start": "2026-01-01",
    "rental_id": "2001",
    "schema_family": "nextgen",
    "source_object_id": "fixture/nextgen-correction",
    "source_timezone": "Europe/London",
    "start_station_code": "001020",
    "start_station_name": "Constructed Start C",
    "start_ts_local": "2026-01-01T08:00:00+00:00"
  },
  {
    "bike_id": "605",
    "bike_model": "CLASSIC",
    "duration_ms": 360000,
    "end_station_code": "001034",
    "end_station_name": "Constructed End G",
    "end_ts_local": "2026-01-02T12:06:00+00:00",
    "header_variant_id": "sha256:bd7b2ebb5148dca5b4b4bce591d0a9acc062c9e3df6cc7eb92530a083c78e7e5",
    "ownership_end": "2026-01-02",
    "ownership_start": "2026-01-01",
    "rental_id": "2005",
    "schema_family": "nextgen",
    "source_object_id": "fixture/nextgen-correction",
    "source_timezone": "Europe/London",
    "start_station_code": "001024",
    "start_station_name": "Constructed Start G",
    "start_ts_local": "2026-01-02T12:00:00+00:00"
  }
]
