[
  {
    "bike_id": "501",
    "bike_model": null,
    "duration_ms": 600000,
    "end_station_code": "0200",
    "end_station_name": "Constructed End A",
    "end_ts_local": "2022-07-27T09:10:00+01:00",
    "header_variant_id": "sha256:fd29b77240c276d9a36d45413034fb40bfb3f9da796e0aef40fd45ea11a9758c",
    "ownership_end": "2022-07-27",
    "ownership_start": "2022-07-27",
    "rental_id": "1001",
    "schema_family": "classic",
    "source_object_id": "fixture/classic-standard",
    "source_timezone": "Europe/London",
    "start_station_code": "0100",
    "start_station_name": "Constructed Start A",
    "start_ts_local": "2022-07-27T09:00:00+01:00"
  },
  {
    "bike_id": "502",
    "bike_model": null,
    "duration_ms": 900000,
    "end_station_code": null,
    "end_station_name": "Constructed End B",
    "end_ts_local": "2022-07-10T11:15:00+01:00",
    "header_variant_id": "sha256:71d7d8f9c87ce5dea1fd9f3a721b9c62d58614b31fc52f9c213eb714bad32bc6",
    "ownership_end": "2022-07-10",
    "ownership_start": "2022-07-10",
    "rental_id": "1002",
    "schema_family": "classic",
    "source_object_id": "fixture/classic-missing-end-station-id",
    "source_timezone": "Europe/London",
    "start_station_code": "0101",
    "start_station_name": "Constructed Start B",
    "start_ts_local": "2022-07-10T11:00:00+01:00"
  },
  {
    "bike_id": "601",
    "bike_model": "CLASSIC",
    "duration_ms": 720000,
    "end_station_code": "001030",
    "end_station_name": "Constructed End C",
    "end_ts_local": "2026-01-01T08:12:00+00:00",
    "header_variant_id": "sha256:bd7b2ebb5148dca5b4b4bce591d0a9acc062c9e3df6cc7eb92530a083c78e7e5",
    "ownership_end": "2026-01-02",
    "ownership_start": "2026-01-01",
    "rental_id": "2001",
    "schema_family": "nextgen",
    "source_object_id": "fixture/nextgen-standard",
    "source_timezone": "Europe/London",
    "start_station_code": "001020",
    "start_station_name": "Constructed Start C",
    "start_ts_local": "2026-01-01T08:00:00+00:00"
  },
  {
    "bike_id": "602",
    "bike_model": "PBSC_EBIKE",
    "duration_ms": 300000,
    "end_station_code": "001031",
    "end_station_name": "Constructed End D",
    "end_ts_local": "2026-01-02T09:05:00+00:00",
    "header_variant_id": "sha256:bd7b2ebb5148dca5b4b4bce591d0a9acc062c9e3df6cc7eb92530a083c78e7e5",
    "ownership_end": "2026-01-02",
    "ownership_start": "2026-01-01",
    "rental_id": "2002",
    "schema_family": "nextgen",
    "source_object_id": "fixture/nextgen-standard",
    "source_timezone": "Europe/London",
    "start_station_code": "001021",
    "start_station_name": "Constructed Start D",
    "start_ts_local": "2026-01-02T09:00:00+00:00"
  },
  {
    "bike_id": "603",
    "bike_model": "CLASSIC",
    "duration_ms": 1200000,
    "end_station_code": "001032",
    "end_station_name": "Constructed End E",
    "end_ts_local": "2025-07-01T10:20:00+01:00",
    "header_variant_id": "sha256:acb72a406ae5c01d81b0ff13f11291117ad7609a8e491d84b0232951e9907636",
    "ownership_end": "2025-07-01",
    "ownership_start": "2025-07-01",
    "rental_id": "2003",
    "schema_family": "nextgen",
    "source_object_id": "fixture/nextgen-station-names-first",
    "source_timezone": "Europe/London",
    "start_station_code": "001022",
    "start_station_name": "Constructed Start E",
    "start_ts_local": "2025-07-01T10:00:00+01:00"
  },
  {
    "bike_id": "604",
    "bike_model": "CLASSIC",
    "duration_ms": 480000,
    "end_station_code": "001033",
    "end_station_name": "Constructed End F",
    "end_ts_local": "2025-07-16T13:08:00+01:00",
    "header_variant_id": "sha256:8f4bcab54708e7b33d943a4b9b323c66008ec09ee445918564c6fedbd194e418",
    "ownership_end": "2025-07-16",
    "ownership_start": "2025-07-16",
    "rental_id": "2004",
    "schema_family": "nextgen",
    "source_object_id": "fixture/nextgen-interleaved",
    "source_timezone": "Europe/London",
    "start_station_code": "001023",
    "start_station_name": "Constructed Start F",
    "start_ts_local": "2025-07-16T13:00:00+01:00"
  }
]
